257;Confusión [Confusion] ;Este conjuro penetra en la mente de las criaturas y las confunde, generándoles delirios y provocándoles acciones incontroladas. Cada criatura dentro de una esfera con un radio de 10 pies (2 casillas, 3 m) centrada en un punto que elijas dentro del alcance del conjuro debe superar una tirada de salvación de Sabiduría para no verse afectada por él<br>Una criatura afectada no puede realizar reacciones y debe tirar un d10 al comienzo de sus turnos para determinar su comportamiento a lo largo del mismo.<br><br><b>d10 — Comportamiento</b><br>1 -La criatura usa todo su movimiento para moverse en una dirección aleatoria. Para determinar en qué dirección se mueve, tira 1d8 y asigna una dirección a cada cara del dado. La criatura no puede realizar ninguna acción en su turno<br>2-6 - La criatura ni se mueve ni realiza acciones en su turno.<br>7-8 - La criatura usa su acción para realizar un ataque de cuerpo a cuerpo contra un criatura determinada aleatoriamente que esté a su alcance. Si no hay criatura cerca de ella, la criatura no hace nada en este turno<br>9-10 - La criatura puede actuar y moverse de forma normal.<br><br>Al final de cada turno, una criatura afectada puede realizar de nuevo una tirada de salvación de Sabiduría. Si la supera, el efecto del conjuro finaliza para ella.;Cuando lanzas este hechizo usando un espacio de conjuros de nivel 5 o superior, el radio de la esfera crece en 5 pies (1 casillas, 1,5 m) por cada nivel de espacio de conjuros por encima de nivel 4.;90;1;1;1;3 cáscaras de nuez;0;1;1 Accion;5;4;Hasta 1 minuto
258;Conjurar animales [Conjure Animals] ;Convocas espíritus feéricos que toman la apariencia de bestias que aparecen en espacios desocupados que puedas ver dentro del alcance del conjuro. Elige una de las siguientes opciones para determinar la aparición que se produce: <br>• Una bestia con valor de desafío 2 o inferior.<br>• Dos bestias con valor de desafío 1 o inferior.<br>• Cuatro bestias con valor de desafío 1/2 o inferior.<br>• Ocho bestias con valor de desafío 1/4 o inferior.<br>Cada bestia se considera feérica y desaparece cuando alcanza los 0 Puntos de Golpe o finaliza el conjuro.<br>Las criaturas invocadas son amistosas contigo y con tus compañeros. Haz una tirada de iniciativa grupal para determinar el orden de sus propios turnos. Ellas obedecen cualquier orden verbal que les mandes (para lo cual no necesitas gastar ningún tipo de acción). Si no les ordenas nada, actuarán sólo en defensa propia contra criaturas hostiles, de otro modo no tomaran acciones. El DM tiene las estadísticas de estas criaturas.; Cuando lanzas este hechizo usando espacios de conjuros superiores, puedes elegir invocar cualquiera de las opciones presentada arriba, y adicionalmente aparecerán más criaturas: el doble si lo lanzas con un espacio de conjuros de nivel 5, el triple con el de nivel 7, y cuatro veces más con el de nivel 9.;60;1;1;0;;0;1;1 Accion;1;3;Hasta 1 hora
259;Conjurar bombardeo [Conjure Barrage] ;Arrojas un arma no mágica o disparas un proyectil de munición no mágica al aire para crear un cono de armas idénticas que se lanzan y luego desaparecen. Cada criatura que se encuentre en un cono de 60 pies (12 casillas, 18 m) debe realizar una tirada de salvación de Destreza. Si la criatura falla la tirada sufre 3d8 puntos de daño por fuego, y la mitad de daño con una salvación con éxito. El tipo de daño que recibe el objetivo es el mismo que el daño que provoca el arma o la munición usada como componente.;;0;1;1;1;un proyectil de munición o un arma arrojadiza.;0;0;1 Accion;1;3;instantaneo
260;Conjurar celestial [Conjure Celestial] ;Invocas a un ser celestial con un valor de desafío de 4 o inferior que aparece en un espacio desocupado que puedas ver dentro del alcance del conjuro. El celestial desaparece en cuanto alcanza los 0 Puntos de Golpe o finaliza el conjuro.<br>El ser celestial es amistoso contigo y con tus compañeros. Haz una tirada de iniciativa para determinar el orden de sus propios turnos. El celestial obedece cualquier orden verbal que le mandes (para lo cual no necesitas gastar ningún tipo de acción), siempre y cuando no viole su alineamiento. Si no le ordenas nada, actuará sólo en defensa propia contra criaturas hostiles, de otro modo no tomará acciones.<br>El DM tiene las estadísticas del celestial.;Cuando lanzas este hechizo usando un espacio de conjuros de nivel 9, invocas a una criatura celestial que supone un valor de desafío de 5 o inferior.;90;1;1;0;;0;1;1 minuto;1;7;Hasta 1 hora
261;Conjurar descarga [Conjure Volley] ;Lanzas un arma no mágica o arrojas un proyectil de munición no mágica al aire y eliges un punto dentro del alcance del conjuro. Cientos de duplicados de la munición o el arma utilizados caen del cielo como si fueran una descarga y luego desaparecen. Cada criatura que se encuentre en un cilindro de 40 pies (8 casillas, 12 m) de radio y 20 pies (4 casillas, 6 m) de altura centrado en el punto elegido debe realizar una tirada de salvación de Destreza. Si la criatura falla la tirada sufre 8d8 puntos de daño, o la mitad si supera la tirada. El tipo de daño es el mismo que el del arma o la munición empleada en el conjuro.;;150;1;1;1;un proyectil de munición o un arma arrojadiza.;0;0;1 Accion;1;5;instantaneo
262;Conjurar elemental [Conjure Elemental] ;Invocas a un sirviente elemental. Elige un área dentro del alcance del conjuro, de aire, tierra, fuego o agua que llene al menos un cubo de 10 pies (2 casillas, 3 m). El elemental apropiado, con un Valor de desafío de 5 o inferior, aparece a 10 pies del área elegida. Por ejemplo, un elemental de fuego emerge de una hoguera, y un elemental de tierra lo hace desde el suelo. El elemental desaparece cuando sus Puntos de Golpe llegan a 0 o finaliza el conjuro.<br>El elemental es amistoso contigo y con tus compañeros. Haz una tirada de iniciativa para determinar el orden de sus propios turnos. El elemental obedece cualquier orden verbal que le mandes (para lo cual no necesitas gastar ningún tipo de acción). Si no le ordenas nada, actuará sólo en defensa propia contra criaturas hostiles, de otro modo no tomará acciones.<br>Si se rompe tu concentración, el elemental no desaparece, al contrario, permanece donde estaba pero pierdes el control sobre él, volviéndose hostil contra ti y tus compañeros, atacándote. No puedes cancelar a un elemental descontrolado y solo desaparecerá cuando transcurra una hora después de su aparición.<br>El DM tiene las estadísticas de esta criatura.;Cuando lanzas este hechizo usando un espacio de conjuros de nivel 6 o superior, el valor de desafío que supone la criatura se incrementa en 1 por cada nivel de espacio de conjuros por encima de nivel 5.;90;1;1;1;quemar incienso para invocar el elemental de aire, arcilla blanda para el de tierra, azufre y fósforo para el de fuego, o agua y arena para el de agua.;0;1;1 minuto;1;5;Hasta 1  hora
263;Conjurar elementales menores [Conjure Minor Elementals] ;Convocas elementales que aparecen en espacios desocupados que puedes ver dentro del alcance del conjuro. Elige una de las siguientes opciones para determinar la aparición que se produce:<br>• Un elemental con valor de desafío de 2 o inferior.<br>• Dos elementales con valor de desafío de 1 o inferior<br>• Cuatro elementales con valor de desafío de 1/2 o inferior.<br>• Ocho elementales con valor de desafío de 1/4 o inferior.<br>Cada elemental invocado por este conjuro desaparece cuando alcanza los 0 Puntos de Golpe o finaliza el conjuro.<br>Los elementales invocados son amistosos contigo y con tus compañeros. Haz una tirada de iniciativa grupal para determinar el orden de sus propios turnos. Los elementales menores obedecen cualquier orden verbal que les mandes (para lo cual no necesitas gastar ningún tipo de acción). Si no les ordenas nada, actuarán sólo en defensa propia contra criaturas hostiles, de otro modo no tomarán acciones.<br>El DM tiene las estadísticas de estas criaturas.;Cuando lanzas este hechizo usando espacios de conjuro superiores, puedes elegir invocar cualquiera de las opciones presentada arriba, y adicionalmente aparecerán más criaturas: el doble si lo lanzas con un espacio de conjuro de nivel 6, y el triple con el de nivel 8.;90;1;1;0;;0;1;1 minuto;1;4;Hasta 1  hora
264;Conjurar ser feérico [Conjure Fey] ;Invocas a una criatura feérica con valor de desafío de 6 o inferior, o a un espíritu feérico para que tome la forma de una bestia con valor de desafío de 6 o inferior. Aparece en un espacio desocupado que puedas ver dentro del alcance del conjuro. La criatura feérica desaparece cuando sus Puntos de Golpe llegan a 0 o finaliza el conjuro<br>La criatura feérica es amistosa contigo y con tus compañeros. Haz una tirada de iniciativa para determinar el orden de sus propios turnos. El ser feérico obedece cualquier orden verbal que le mandes (para lo cual no necesitas gastar ningún tipo de acción) siempre y cuando no viole su alineamiento. Si no le ordenas nada, actuará sólo en defensa propia contra criaturas hostiles, de otro modo no tomará acciones<br>Si se rompe tu concentración, la criatura feérica no desaparece, al contrario, permanece donde estaba pero pierdes el control sobre ella, volviéndose hostil contra ti y tus compañeros, atacándote. No puedes cancelar a una criatura feérica descontrolada y solo desaparecerá cuando transcurra una hora después de su aparición.<br>El DM tiene las estadísticas de esta criatura.;Cuando lanzas este hechizo usando un espacio de conjuros de nivel 7 o superior, el valor de desafío que supone la criatura se incrementa en 1 por cada nivel de espacio de conjuros por encima de nivel 6.;90;1;1;0;;0;1;1 minuto;1;6;Hasta 1 hora
