250&Clonar [Clone] &Este conjuro hace crecer un duplicado inerte de una criatura viva como garantía contra la muerte. Este clon se forma dentro de un recipiente sellado y adquiere su tamaño final y madurez después de 120 días; además también puedes hacer que el clon sea una versión más joven de la misma criatura. El clon permanecerá inerte hasta la eternidad mientras su recipiente no sea profanado.<br>En cualquier momento después de que el clon madure, si la criatura original muere, su alma es transferida al clon, siempre y cuando el alma sea libre y quiera regresar. El clon es físicamente idéntico al original y tiene la misma personalidad, memoria y habilidades, pero no conserva nada del equipamiento que pudiera llevar. El cuerpo de la criatura original perdura, si todavía existe, en estado inerte, y no puede ser devuelto a la vida ya que su alma no está disponible.&&1&1&1&1&un diamante por valor de 1.000 po, y al menos una pulgada cú- bica (1cm3 aprox.) de materia de la criatura que va a ser clonada, que el conjuro consume, y un recipiente por valor de 2.000 po que tenga una tapa estanca y que sea lo suficientemente grande para albergar una criatura de tamaño Medio, como por ejemplo una urna enorme, un ataúd, una tumba arcillosa cavada en el suelo o un contenedor de crista lleno de agua salada&0&0&1 hora&6&8&instantaneo
251&Cobijo seguro de Leomund [Leomund’s Tiny Hut] &Una cúpula inmóvil de fuerza de 10 pies (2 casillas, 3 m) de radio cobra existencia alrededor y por encima de ti y permanece estática mientras dura el conjuro. El hechizo termina si sales del área <br>Nueve criaturas de tamaño mediano o menor pueden caber dentro contigo. El conjuro falla si su área incluye una criatura mayor o más de nueve criaturas. Las criaturas y objetos que se encuentren dentro de la cúpula cuando lanzas el conjuro pueden moverse por ella libremente. El resto de criaturas y objetos quedan impedidas de pasar a través de ella. Conjuros y otros efectos mágicos no se pueden extender a través de la cúpula o ser lanzados a través de ella. La atmósfera del espacio interior es confortable y seca, independientemente del tiempo en el exterior.<br>Hasta que el conjuro finalice, puedes hacer que el interior quede iluminado en luz tenue o a oscuras. La cúpula es opaca desde el exterior, del color que elijas, pero es transparente desde el interior.&&0&1&1&1&una pequeña cuenta de cristal&1&0&1 minuto&2&3&8 horas
252&Cofre secreto de Leomund [Leomund’s Secret Chest]&Escondes un cofre y todo su contenido en el Plano Etéreo. Debes tocar el cofre y la réplica en miniatura que funcionan como componentes materiales del conjuro. El cofre puede contener hasta 12 pies cúbicos (340 litros [0,34 m³]) de material no vivo (3 pies [90 cm] por 2 pies [60 cm] por 2 pies [60 cm])<br>Mientras el cofre permanezca en el Plano Etéreo, puedes usar una acción y tocar la réplica para traer de vuelta el cofre.<br>Éste aparece en un espacio desocupado en el suelo a 5 pies (1 casilla, 1,5 m) de ti. Puedes enviar de vuelta el cofre al Plano Etéreo usando una acción y tocando ambos cofres.<br>Después de 60 días, hay una probabilidad de un 5 por ciento acumulativo por día de que el efecto del conjuro finalice. Este efecto termina si lanzas el conjuro otra vez, si la réplica pequeña del cofre es destruida, o si eliges terminar el conjuro como una acción. Si el conjuro finaliza y el cofre grande está en el Plano Etéreo, se pierde irremediablemente.&&1&1&1&1&un cofre exquisito, de 3 pies [90 cm] por 2 pies [60 cm] por 2 pies [60 cm], construido con materiales raros por valor de al menos 5.000 po, y una réplica diminuta creada con los mismos materiales por valor de al menos 50 po&0&0&1 Accion&1&4&instantaneo
253&Comprensión idiomática [Comprehend Languages]&Mientras dura el conjuro, comprendes el significado literal de cualquier idioma hablado que oigas. También comprendes cualquier idioma escrito que veas, pero debes estar tocando la superficie sobre la cual están escritas las palabras. Es necesario alrededor de 1 minuto para leer una página de texto.<br>Este conjuro no descifra mensajes secretos en un texto o un glifo, como en un sello arcano, que no es parte de un idioma escrito.&&0&1&1&1&una pizca de hollín y de sal&1&0&1 Accion&8&1&1 hora
254&Compulsión [Compulsion]&Las criaturas a tu elección que puedas ver y te puedan oír dentro del alcance del conjuro deben realizar una tirada de salvación de Sabiduría. Un objetivo supera esta tirada de salvación automáticamente si no puede ser encantado. En caso de que la tirada falle, el objetivo se verá afectado por el conjuro. Hasta que el conjuro finalice, puedes utilizar una acción adicional en cada uno de tus turnos para elegir una dirección horizontal a ti. Cada objetivo afectado por el conjuro, en su siguiente turno, debe utilizar el máximo de su capacidad de movimiento para moverse en esa dirección. El objetivo puede realizar su acción antes de moverse. Después de moverse de este modo, puede realizar una tirada de salvación de Sabiduría para intentar finalizar el efecto.<br>Un objetivo no puede ser forzado a caminar hacia un peligro mortal, como por ejemplo caminar hacia el fuego o hacia un pozo, pero puede provocar ataques de oportunidad al moverse en la dirección indicada.&&30&1&1&0&&0&1&1 Accion&5&4&Hasta 1 minuto
255&Comunión [Commune] &Contactas con tu deidad o una representación divina pudiendo realizar hasta tres preguntas que pueden ser respondidas con sí o no. Debes realizar tus preguntas antes de que finalice el conjuro. Recibes una respuesta correcta a cada pregunta.<br>Los seres divinos no son necesariamente omniscientes, así que podrías recibir como respuesta un “no lo tengo claro” si una pregunta tiene que ver con información que se encuentra más allá del conocimiento de la deidad. En el caso de que dar una repuesta de una sola palabra pudiese inducir a error o se oponga a los intereses de la deidad, el DM podría en su lugar ofrecer una frase breve como respuesta.<br>Si lanzas el conjuro dos o más veces antes de finalizar tu próximo descanso prolongado, existe un 25% acumulativo de posibilidades por cada lanzamiento después del primero de que no obtengas respuesta. El DM realiza esta tirada en secreto.&&0&1&1&1&incienso y un vial de agua bendita o sacrílega&1&0&1 minuto&8&5&1 minuto
256&Comunión con la naturaleza [Commune with Nature] &Te conviertes en uno con la naturaleza por un breve tiempo y obtienes conocimientos sobre el territorio circundante. En el exterior, el conjuro te proporciona conocimiento de la tierra hasta 3 millas (4,8km aprox.) de donde lo lanzas. En cuevas y otros entornos subterráneos naturales, el radio de conocimiento se limita a 300 pies (60 casillas, 90 m). El conjuro no funciona si el lugar ha sido modificado por construcciones, como por ejemplo, en una mazmorra o en una ciudad<br>Inmediatamente ganas conocimiento a tu elección de cualquiera de los siguientes hechos relativos a los siguientes elementos que se encuentran en la zona:<br>• Terrenos y cuerpos de agua<br>• Plantas nativas de la zona, minerales, animales o gentes.<br>• Poderosos celestiales, feéricos, infernales, elementales o muertos vivientes.<br> • Influencia desde otros planos de existencia.<br>• Edificios.<br>Por ejemplo, puedes llegar a conocer la localización de una poderosa área de muertos vivientes, la localización de manantiales de agua potable, o la localización de cualquier ciudad cercana.&&0&1&1&0&&1&0&1 minuto&8&5&instantaneo
257&Confusión [Confusion] &Este conjuro penetra en la mente de las criaturas y las confunde, generándoles delirios y provocándoles acciones incontroladas. Cada criatura dentro de una esfera con un radio de 10 pies (2 casillas, 3 m) centrada en un punto que elijas dentro del alcance del conjuro debe superar una tirada de salvación de Sabiduría para no verse afectada por él<br>Una criatura afectada no puede realizar reacciones y debe tirar un d10 al comienzo de sus turnos para determinar su comportamiento a lo largo del mismo.<br><br><b>d10 — Comportamiento</b><br>1 -La criatura usa todo su movimiento para moverse en una dirección aleatoria. Para determinar en qué dirección se mueve, tira 1d8 y asigna una dirección a cada cara del dado. La criatura no puede realizar ninguna acción en su turno<br>2-6 - La criatura ni se mueve ni realiza acciones en su turno.<br>7-8 - La criatura usa su acción para realizar un ataque de cuerpo a cuerpo contra un criatura determinada aleatoriamente que esté a su alcance. Si no hay criatura cerca de ella, la criatura no hace nada en este turno<br>9-10 - La criatura puede actuar y moverse de forma normal.<br><br>Al final de cada turno, una criatura afectada puede realizar de nuevo una tirada de salvación de Sabiduría. Si la supera, el efecto del conjuro finaliza para ella.&Cuando lanzas este hechizo usando un espacio de conjuros de nivel 5 o superior, el radio de la esfera crece en 5 pies (1 casillas, 1,5 m) por cada nivel de espacio de conjuros por encima de nivel 4.&90&1&1&1&3 cáscaras de nuez&0&1&1 Accion&5&4&Hasta 1 minuto
258&Conjurar animales [Conjure Animals] &Convocas espíritus feéricos que toman la apariencia de bestias que aparecen en espacios desocupados que puedas ver dentro del alcance del conjuro. Elige una de las siguientes opciones para determinar la aparición que se produce: <br>• Una bestia con valor de desafío 2 o inferior.<br>• Dos bestias con valor de desafío 1 o inferior.<br>• Cuatro bestias con valor de desafío 1/2 o inferior.<br>• Ocho bestias con valor de desafío 1/4 o inferior.<br>Cada bestia se considera feérica y desaparece cuando alcanza los 0 Puntos de Golpe o finaliza el conjuro.<br>Las criaturas invocadas son amistosas contigo y con tus compañeros. Haz una tirada de iniciativa grupal para determinar el orden de sus propios turnos. Ellas obedecen cualquier orden verbal que les mandes (para lo cual no necesitas gastar ningún tipo de acción). Si no les ordenas nada, actuarán sólo en defensa propia contra criaturas hostiles, de otro modo no tomaran acciones. El DM tiene las estadísticas de estas criaturas.&Cuando lanzas este hechizo usando espacios de conjuros superiores, puedes elegir invocar cualquiera de las opciones presentada arriba, y adicionalmente aparecerán más criaturas: el doble si lo lanzas con un espacio de conjuros de nivel 5, el triple con el de nivel 7, y cuatro veces más con el de nivel 9.&60&1&1&0&&0&1&1 Accion&1&3&Hasta 1 hora
259&Conjurar bombardeo [Conjure Barrage] &Arrojas un arma no mágica o disparas un proyectil de munición no mágica al aire para crear un cono de armas idénticas que se lanzan y luego desaparecen. Cada criatura que se encuentre en un cono de 60 pies (12 casillas, 18 m) debe realizar una tirada de salvación de Destreza. Si la criatura falla la tirada sufre 3d8 puntos de daño por fuego, y la mitad de daño con una salvación con éxito. El tipo de daño que recibe el objetivo es el mismo que el daño que provoca el arma o la munición usada como componente.&&0&1&1&1&un proyectil de munición o un arma arrojadiza.&0&0&1 Accion&1&3&instantaneo
260&Conjurar celestial [Conjure Celestial] &Invocas a un ser celestial con un valor de desafío de 4 o inferior que aparece en un espacio desocupado que puedas ver dentro del alcance del conjuro. El celestial desaparece en cuanto alcanza los 0 Puntos de Golpe o finaliza el conjuro.<br>El ser celestial es amistoso contigo y con tus compañeros. Haz una tirada de iniciativa para determinar el orden de sus propios turnos. El celestial obedece cualquier orden verbal que le mandes (para lo cual no necesitas gastar ningún tipo de acción), siempre y cuando no viole su alineamiento. Si no le ordenas nada, actuará sólo en defensa propia contra criaturas hostiles, de otro modo no tomará acciones.<br>El DM tiene las estadísticas del celestial.&Cuando lanzas este hechizo usando un espacio de conjuros de nivel 9, invocas a una criatura celestial que supone un valor de desafío de 5 o inferior.&90&1&1&0&&0&1&1 minuto&1&7&Hasta 1 hora
261&Conjurar descarga [Conjure Volley] &Lanzas un arma no mágica o arrojas un proyectil de munición no mágica al aire y eliges un punto dentro del alcance del conjuro. Cientos de duplicados de la munición o el arma utilizados caen del cielo como si fueran una descarga y luego desaparecen. Cada criatura que se encuentre en un cilindro de 40 pies (8 casillas, 12 m) de radio y 20 pies (4 casillas, 6 m) de altura centrado en el punto elegido debe realizar una tirada de salvación de Destreza. Si la criatura falla la tirada sufre 8d8 puntos de daño, o la mitad si supera la tirada. El tipo de daño es el mismo que el del arma o la munición empleada en el conjuro.&&150&1&1&1&un proyectil de munición o un arma arrojadiza.&0&0&1 Accion&1&5&instantaneo
262&Conjurar elemental [Conjure Elemental] &Invocas a un sirviente elemental. Elige un área dentro del alcance del conjuro, de aire, tierra, fuego o agua que llene al menos un cubo de 10 pies (2 casillas, 3 m). El elemental apropiado, con un Valor de desafío de 5 o inferior, aparece a 10 pies del área elegida. Por ejemplo, un elemental de fuego emerge de una hoguera, y un elemental de tierra lo hace desde el suelo. El elemental desaparece cuando sus Puntos de Golpe llegan a 0 o finaliza el conjuro.<br>El elemental es amistoso contigo y con tus compañeros. Haz una tirada de iniciativa para determinar el orden de sus propios turnos. El elemental obedece cualquier orden verbal que le mandes (para lo cual no necesitas gastar ningún tipo de acción). Si no le ordenas nada, actuará sólo en defensa propia contra criaturas hostiles, de otro modo no tomará acciones.<br>Si se rompe tu concentración, el elemental no desaparece, al contrario, permanece donde estaba pero pierdes el control sobre él, volviéndose hostil contra ti y tus compañeros, atacándote. No puedes cancelar a un elemental descontrolado y solo desaparecerá cuando transcurra una hora después de su aparición.<br>El DM tiene las estadísticas de esta criatura.&Cuando lanzas este hechizo usando un espacio de conjuros de nivel 6 o superior, el valor de desafío que supone la criatura se incrementa en 1 por cada nivel de espacio de conjuros por encima de nivel 5.&90&1&1&1&quemar incienso para invocar el elemental de aire, arcilla blanda para el de tierra, azufre y fósforo para el de fuego, o agua y arena para el de agua.&0&1&1 minuto&1&5&Hasta 1 hora
263&Conjurar elementales menores [Conjure Minor Elementals] &Convocas elementales que aparecen en espacios desocupados que puedes ver dentro del alcance del conjuro. Elige una de las siguientes opciones para determinar la aparición que se produce:<br>• Un elemental con valor de desafío de 2 o inferior.<br>• Dos elementales con valor de desafío de 1 o inferior<br>• Cuatro elementales con valor de desafío de 1/2 o inferior.<br>• Ocho elementales con valor de desafío de 1/4 o inferior.<br>Cada elemental invocado por este conjuro desaparece cuando alcanza los 0 Puntos de Golpe o finaliza el conjuro.<br>Los elementales invocados son amistosos contigo y con tus compañeros. Haz una tirada de iniciativa grupal para determinar el orden de sus propios turnos. Los elementales menores obedecen cualquier orden verbal que les mandes (para lo cual no necesitas gastar ningún tipo de acción). Si no les ordenas nada, actuarán sólo en defensa propia contra criaturas hostiles, de otro modo no tomarán acciones.<br>El DM tiene las estadísticas de estas criaturas.&Cuando lanzas este hechizo usando espacios de conjuro superiores, puedes elegir invocar cualquiera de las opciones presentada arriba, y adicionalmente aparecerán más criaturas: el doble si lo lanzas con un espacio de conjuro de nivel 6, y el triple con el de nivel 8.&90&1&1&0&&0&1&1 minuto&1&4&Hasta 1 hora
264&Conjurar ser feérico [Conjure Fey] &Invocas a una criatura feérica con valor de desafío de 6 o inferior, o a un espíritu feérico para que tome la forma de una bestia con valor de desafío de 6 o inferior. Aparece en un espacio desocupado que puedas ver dentro del alcance del conjuro. La criatura feérica desaparece cuando sus Puntos de Golpe llegan a 0 o finaliza el conjuro<br>La criatura feérica es amistosa contigo y con tus compañeros. Haz una tirada de iniciativa para determinar el orden de sus propios turnos. El ser feérico obedece cualquier orden verbal que le mandes (para lo cual no necesitas gastar ningún tipo de acción) siempre y cuando no viole su alineamiento. Si no le ordenas nada, actuará sólo en defensa propia contra criaturas hostiles, de otro modo no tomará acciones<br>Si se rompe tu concentración, la criatura feérica no desaparece, al contrario, permanece donde estaba pero pierdes el control sobre ella, volviéndose hostil contra ti y tus compañeros, atacándote. No puedes cancelar a una criatura feérica descontrolada y solo desaparecerá cuando transcurra una hora después de su aparición.<br>El DM tiene las estadísticas de esta criatura.&Cuando lanzas este hechizo usando un espacio de conjuros de nivel 7 o superior, el valor de desafío que supone la criatura se incrementa en 1 por cada nivel de espacio de conjuros por encima de nivel 6.&90&1&1&0&&0&1&1 minuto&1&6&Hasta 1 hora
265&Conjurar seres de los bosques&Convocas criaturas feéricas que aparecen en espacios desocupados que puedes ver dentro del alcance del conjuro. Elige una de las siguientes opciones para determinar la aparición que se produce:<br> • Una criatura feérica con valor de desafío de 2 o inferior. <br>• Dos criaturas feéricas con valor de desafío de 1 o inferior.<br> • Cuatro criaturas feéricas con valor de desafío de 1/2 o inferior.<br> • Ocho criaturas feéricas con valor de desafío de 1/4 o inferior. <br>Cada criatura feérica invocada por este conjuro desaparece cuando alcanza los 0 Puntos de Golpe o finaliza el conjuro. Las criaturas feéricas invocadas son amistosas contigo y con tus compañeros. Haz una tirada de iniciativa grupal para determinar el orden de sus propios turnos. Las criaturas feéricas obedecen cualquier orden verbal que les mandes (para lo cual no necesitas gastar ningún tipo de acción). Si no les ordenas nada, actuarán sólo en defensa propia contra criaturas hostiles, de otro modo no tomarán acciones.<br> El DM tiene las estadísticas de estas criaturas.&Cuando lanzas este hechizo usando espacios de conjuro superiores, puedes elegir invocar cualquiera de las opciones presentada arriba, y adicionalmente aparecerán más criaturas: el doble si lo lanzas con un espacio de conjuro de nivel 6, y el triple con el de nivel 8.&60&1&1&1&una baya de acebo por cada criatura invocada&0&1&1 accion&1&4&hasta 1 hora
266&Cono de frío [Cone of Cold]&Un estallido de frío intenso surge de tus manos. Cada criatura en un cono de 60 pies (12 casillas, 18 m) debe realizar una tirada de salvación de Constitución. Si falla la tirada, la criatura sufre 8d8 puntos de daño por frío, o la mitad del daño con una salvación con éxito.<br> Si una criatura muere a causa de esta daño queda convertirá en un estatua de hielo hasta que se funda.&Cuando lanzas este hechizo usando un espacio de conjuros de nivel 6 o superior, el daño se incrementa en 1d8 por cada nivel de espacio de conjuros por encima de nivel 5.&0&1&1&1&un pequeño cono de vidrio o crista&0&0&1 Accion&2&5&instantaneo
267&Conocimiento de leyendas [Legend Lore]&Nombra o describe a una persona, lugar u objeto. El conjuro trae a tu mente un breve resumen de la sabiduría popular acerca de lo que nombraste. El conocimiento puede consistir en cuentos actuales, historias olvidadas, e incluso saberes secretos que nunca han sido ampliamente conocidos. Si la cosa que nombras no tiene una importancia propia de leyendas, no consigues información. Mientras más información ya poseas acerca de la cosa, más precisa y detallada será la nueva información recibida.<br> La información que descubres es rigurosa pero puede estar expresada en lenguaje figurativo. Por ejemplo, si tienes un hacha misteriosa en la mano, el conjuro puede dar esta información: “Infortunio para el malhechor que toca el hacha, pues hasta la empuñadura rebana la mano de los malvados. Sólo un verdadero Hijo de la Piedra, amante y amado de Moradin, podría despertar los verdaderos poderes del hacha, y sólo con la sagrada palabra Rudnogg en los labios.”&&0&1&1&1&incienso por valor de al menos 250 po, que el conjuro consume, y cuatro tiras de marfil por valor de al menos 50 po cada una.&0&0&10 minutos&8&5&instantaneo
268&Contactar con otro plano&"Mentalmente contactas o bien con un semidios, el espíritu de un sabio muerto hace mucho tiempo, o alguna otra misteriosa entidad de otro plano. Contactar con estas inteligencias de otros planos puede deformar o incluso romper tu mente. Cuando lanzas este conjuro debes superar una tirada de salvación de CD 15 de Inteligencia. En caso de fallar la tirada sufres 6d6 puntos de daño psíquico y enloqueces hasta que tomes un descanso prolongado. Mientras estás loco, no puedes llevar a cabo acciones, no puedes entender lo que otras criaturas dicen, no puedes leer, y sólo puedes decir galimatías. Solo un conjuro de restablecimiento mayor [greater restoration] puede finalizar este efecto. <br>En caso de que superes la tirada de salvación, puedes hacer 5 preguntas a la entidad contactada. Debes formular las preguntas antes de que finalice el efecto del conjuro. El DM responderá cada pregunta con monosílabos del tipo ""si"", ""no"", ""puede"", ""nunca"", ""irrelevante"" o ""confuso"" (si la entidad contactada no conoce la respuesta a la pregunta). Si el DM considera que con monosílabos la respuesta puede ser malinterpretada, puede ofrecer a cambio una frase corta como respuesta."&&0&1&0&0&&1&0&1 minuto&8&5&1 minuto
269&Contacto electrizante [Shocking Grasp]&Un relámpago brota de tu mano enviando una onda de choque a la criatura que intentas tocar. Haz un ataque de conjuro cuerpo a cuerpo contra el objetivo. Tienes ventaja en la tirada de ataque si el objetivo lleva puesta una armadura hecha de metal. Al impactar, el objetivo sufre 1d8 puntos de daño por electricidad, y no puede realizar reacciones hasta el inicio de su próximo turno.&El daño del conjuro se ve incrementado por 1d8 cuando alcanzas nivel 5 (2d8), nivel 11 (3d8) y nivel 17 (4d8).&1&1&1&0&&0&0&1 accion&2&0&instantaneo
270&Contagio [Contagion]&Tu toque inflige enfermedad. Realiza un ataque de conjuro cuerpo a cuerpo contra una criatura a tu alcance. En caso de impactar, contagia a la criatura una enfermedad de tu elección entre las opciones que se describen debajo. <br>Al final del turno del objetivo este debe realizar una tirada de salvación de Constitución. Después del tercer fallo en estas tiradas de salvación, el objetivo dejará de hacer estas tiradas y la enfermedad invadirá su cuerpo durante la duración del conjuro. Si por el contrario acierta tres veces en las tiradas de salvación, la criatura se recupera de la enfermedad y el conjuro finaliza.<br> Ya que este conjuro provoca una enfermedad natural en el objetivo, se aplica cualquier efecto que cure la enfermedad o la mejore. <br><b>Ceguera:</b>El dolor comprime la mente de la criatura y sus ojos se vuelven de un color blanco lechoso. La criatura queda cegada y gana desventaja en tiradas de característica y de salvación basadas en la Sabiduría. <br><b>Fiebre porcina:</b> Una fiebre altísima se extiende por el cuerpo de la criatura. La criatura sufre desventaja en pruebas de característica, de salvación y de ataque basadas en la Fuerza.<br><b> Carne putrefacta:</b> La carne de la criatura se pudre. La criatura sufre desventaja en tiradas de característica basadas en Carisma y pasa a ser vulnerable a cualquier tipo de daño.<br><b> Mente ardiente:</b>  La mente de la criatura comienza a estar febril. La criatura sufre desventaja en tiradas de característica y salvación basadas en la Inteligencia, y la criatura empieza a actuar en el combate como si estuviera bajo los efectos del hechizo de confusión [Confusion].<br><b> Epilepsia:</b> la criatura comienza a sufrir espasmos. La criatura sufre desventaja en tiradas de característica, de salvación y de ataque basadas en la Destreza. <br><b>Perdición Babosa:</b> La criatura comienza a sangrar de forma incontrolada. La criatura sufre desventaja en tiradas de característica y de salvación basadas en la Constitución. Además, cuando la criatura sufre daño, queda aturdida hasta el comienzo de su siguiente turno.&&1&1&1&0&&0&0&1 Accion&6&5&7 dias
